{"configurationSha256":"8ca04064e609c40d0fb0401068e084738d7a0755b932eb333bb99e61eae6855b","datasetId":"fleetpy-manhattan-zenodo-15187906-v1","eligibleRecordCount":2676,"eventOrderingId":"ridebound-event-order-v1","excludedRecordCount":15842,"exclusionLogSha256":"4cbad5a329b2ba1e51e462b34bef13b4fbbf465ab065f91ad75dec8c8e3f8b0c","inputRecordCount":18518,"normalizerId":"fleetpy-manhattan-normalizer","normalizerSourceSha256":"34517a832014c78a572282e01795fc243896db088249fd6dade70beed2aa4d90","normalizerVersion":"1.0.0","reportId":"report-3b5adc93abf9b36292c28e02","roundingRuleId":"ties-to-even-v1","scenarioContentSha256":"28fe416106474971c8a040d8e65d8a3cf184e15dbbd90cc478a76c1e8af95c45","scenarioHash":"3b5adc93abf9b36292c28e026fe858d45c21baf57a40a78d2b474233afe89117","schemaVersion":"1.0.1","selectedRecordCount":108,"selectionFrameSha256":"833e6e0645f9795eece91bd73949817b39946ec3b24c676200653e17c72830e5","selectionRuleId":"greedy-induced-coverage-node-pool-hmac-row-v1","sourceArtifactSha256":"d9e86f33645e5eec287d387f8d63ad41ddf41d4ef648138b65d636482e2c599e","sourceMemberInventorySha256":"f9b28bb17850881e2e1a0784d7ff0aa1885b7175ab9be8db5e8ac6d969240bbd"}