{"configurationSha256":"d4e6707f5f9e1a2648c068d3d519c0e4303dc53ba2bc9ef7dcba64cb40839e4e","datasetId":"fleetpy-manhattan-zenodo-15187906-v1","eligibleRecordCount":1722,"eventOrderingId":"ridebound-event-order-v1","excludedRecordCount":24037,"exclusionLogSha256":"73535cb3a76176242bb2e8bd457984c4f0e56db5c1f4a95aa50a48394882347b","inputRecordCount":25759,"normalizerId":"fleetpy-manhattan-normalizer","normalizerSourceSha256":"34517a832014c78a572282e01795fc243896db088249fd6dade70beed2aa4d90","normalizerVersion":"1.0.0","reportId":"report-b2c2f295d6dc921a2ce2101b","roundingRuleId":"ties-to-even-v1","scenarioContentSha256":"073bf9ddff5612e558cb61bd4bcfbca9a2101ff7871342a66598a1c16613fc35","scenarioHash":"b2c2f295d6dc921a2ce2101b5d31588335d4bde89c30daf798a346406f035ae3","schemaVersion":"1.0.1","selectedRecordCount":108,"selectionFrameSha256":"0639e230541d193fc1a85a6cd8dc11b5321725a8150d6ec7f591a30f9a6c9b90","selectionRuleId":"greedy-induced-coverage-node-pool-hmac-row-v1","sourceArtifactSha256":"d9e86f33645e5eec287d387f8d63ad41ddf41d4ef648138b65d636482e2c599e","sourceMemberInventorySha256":"f9b28bb17850881e2e1a0784d7ff0aa1885b7175ab9be8db5e8ac6d969240bbd"}