{"configurationSha256":"9cf00ee9f356d761f0a2cf3c41dbbcde110a51572a36dd8c8f50faa2ab35757f","datasetId":"fleetpy-manhattan-zenodo-15187906-v1","eligibleRecordCount":1337,"eventOrderingId":"ridebound-event-order-v1","excludedRecordCount":19629,"exclusionLogSha256":"8f68d948991035cce484e5b1b0e8dbbe79746883d13be0cc98b5579914b6c646","inputRecordCount":20966,"normalizerId":"fleetpy-manhattan-normalizer","normalizerSourceSha256":"34517a832014c78a572282e01795fc243896db088249fd6dade70beed2aa4d90","normalizerVersion":"1.0.0","reportId":"report-a1186fe18ae65d7f182d8498","roundingRuleId":"ties-to-even-v1","scenarioContentSha256":"a5feece1dfe329cb39634e045e9462b9debf2371975781ae568e35679340849e","scenarioHash":"a1186fe18ae65d7f182d8498511ed053865af79c81c513a7c3d4af65895b74ff","schemaVersion":"1.0.1","selectedRecordCount":108,"selectionFrameSha256":"2422cc4c12d2d56d2140e60c6bf9997851c402ae0b449feb60042dcb325cff24","selectionRuleId":"greedy-induced-coverage-node-pool-hmac-row-v1","sourceArtifactSha256":"d9e86f33645e5eec287d387f8d63ad41ddf41d4ef648138b65d636482e2c599e","sourceMemberInventorySha256":"f9b28bb17850881e2e1a0784d7ff0aa1885b7175ab9be8db5e8ac6d969240bbd"}