{"configurationSha256":"400ee3684e2427439266bd30d7fcaffb17123d209c5b54a302e7fcb15b7fc6b0","datasetId":"fleetpy-manhattan-zenodo-15187906-v1","eligibleRecordCount":21400,"eventOrderingId":"ridebound-event-order-v1","excludedRecordCount":0,"exclusionLogSha256":"4f53cda18c2baa0c0354bb5f9a3ecbe5ed12ab4d8e11ba873c2f11161202b945","inputRecordCount":21400,"normalizerId":"fleetpy-manhattan-normalizer","normalizerSourceSha256":"34517a832014c78a572282e01795fc243896db088249fd6dade70beed2aa4d90","normalizerVersion":"1.0.0","reportId":"report-34fb3fe1e9e61aea5200d90e","roundingRuleId":"ties-to-even-v1","scenarioContentSha256":"204550318b9426d7a812ab08ead8752fd69314964c8b1a5018db42e3b189d3dc","scenarioHash":"34fb3fe1e9e61aea5200d90e76cc307c84fe27875a90a6922cb25fe5a5faa4ca","schemaVersion":"1.0.1","selectedRecordCount":128,"selectionFrameSha256":"5664ffb8d3e41a00202e5aaa708f2d3aa8d20fc611a8a3054401d2af3b2c1f04","selectionRuleId":"greedy-induced-coverage-node-pool-hmac-row-v1","sourceArtifactSha256":"d9e86f33645e5eec287d387f8d63ad41ddf41d4ef648138b65d636482e2c599e","sourceMemberInventorySha256":"f9b28bb17850881e2e1a0784d7ff0aa1885b7175ab9be8db5e8ac6d969240bbd"}