{"configurationSha256":"6d84bd76db25272b45c44c9b096e95c327b3bb8c3c4204844d300bf601f9df6c","datasetId":"fleetpy-manhattan-zenodo-15187906-v1","eligibleRecordCount":1596,"eventOrderingId":"ridebound-event-order-v1","excludedRecordCount":24163,"exclusionLogSha256":"82f63958ca22780eca10bb242de24a3373b8e8d6966c2100a7441af6c1e0f50a","inputRecordCount":25759,"normalizerId":"fleetpy-manhattan-normalizer","normalizerSourceSha256":"34517a832014c78a572282e01795fc243896db088249fd6dade70beed2aa4d90","normalizerVersion":"1.0.0","reportId":"report-de4a7c0a7a513773dce12580","roundingRuleId":"ties-to-even-v1","scenarioContentSha256":"e6b4c59b6e552203a7d2c66f6f82483879743b4f7e7991f3339f9364aefa0714","scenarioHash":"de4a7c0a7a513773dce1258018aadabaeca017602ddc9a96cecce68ef957af5f","schemaVersion":"1.0.1","selectedRecordCount":108,"selectionFrameSha256":"be36ffa85c440657a2e1e6922f1c2c020bdee0915168f15e9dd4b5fec5488911","selectionRuleId":"greedy-induced-coverage-node-pool-hmac-row-v1","sourceArtifactSha256":"d9e86f33645e5eec287d387f8d63ad41ddf41d4ef648138b65d636482e2c599e","sourceMemberInventorySha256":"f9b28bb17850881e2e1a0784d7ff0aa1885b7175ab9be8db5e8ac6d969240bbd"}