{"configurationSha256":"08398a22cf6a4f6de4aed6316a051830a1bf9e53d2f96f63e4eefdf0c1db297f","datasetId":"fleetpy-manhattan-zenodo-15187906-v1","eligibleRecordCount":2286,"eventOrderingId":"ridebound-event-order-v1","excludedRecordCount":19114,"exclusionLogSha256":"5253d63171d6e11de6ac0bd712ee746a99371f09e08341045ad253472661f52e","inputRecordCount":21400,"normalizerId":"fleetpy-manhattan-normalizer","normalizerSourceSha256":"34517a832014c78a572282e01795fc243896db088249fd6dade70beed2aa4d90","normalizerVersion":"1.0.0","reportId":"report-00b4990d67f3dad5fbbd45d0","roundingRuleId":"ties-to-even-v1","scenarioContentSha256":"281417e3d4262b71ca4f737155d11836fe2c2dd2eadbabf2f19024bdbab65c72","scenarioHash":"00b4990d67f3dad5fbbd45d00462f432c4657d01be0653ee47d7b2e77cbe56dd","schemaVersion":"1.0.1","selectedRecordCount":128,"selectionFrameSha256":"8f6391a64b0d3b0311d09cc46d1ff7bd28357c604816e670edfa61a74dce9853","selectionRuleId":"greedy-induced-coverage-node-pool-hmac-row-v1","sourceArtifactSha256":"d9e86f33645e5eec287d387f8d63ad41ddf41d4ef648138b65d636482e2c599e","sourceMemberInventorySha256":"f9b28bb17850881e2e1a0784d7ff0aa1885b7175ab9be8db5e8ac6d969240bbd"}