{"configurationSha256":"878ed164fe3382278d5ed42b6721f9082678cf0e5b9bd3ac47ea42fd3e2b553f","datasetId":"fleetpy-manhattan-zenodo-15187906-v1","eligibleRecordCount":3120,"eventOrderingId":"ridebound-event-order-v1","excludedRecordCount":18280,"exclusionLogSha256":"d172a5de2391898bda9d4190b9b9bef2933d765c775b2d7209b841abd8ac9f00","inputRecordCount":21400,"normalizerId":"fleetpy-manhattan-normalizer","normalizerSourceSha256":"34517a832014c78a572282e01795fc243896db088249fd6dade70beed2aa4d90","normalizerVersion":"1.0.0","reportId":"report-df9d29dc85c66a546688d5d7","roundingRuleId":"ties-to-even-v1","scenarioContentSha256":"8fc38fde100fd459ff7554e82e17174a105d450d9bfadf043ac1309269b1d3b3","scenarioHash":"df9d29dc85c66a546688d5d7d1e617e702a2d806c9076f638f6017a5af05f195","schemaVersion":"1.0.1","selectedRecordCount":108,"selectionFrameSha256":"4da0808e8a445f36da54b0dfd4e9cde333c3dee6b4917fc3fa18495b65c5c2f9","selectionRuleId":"greedy-induced-coverage-node-pool-hmac-row-v1","sourceArtifactSha256":"d9e86f33645e5eec287d387f8d63ad41ddf41d4ef648138b65d636482e2c599e","sourceMemberInventorySha256":"f9b28bb17850881e2e1a0784d7ff0aa1885b7175ab9be8db5e8ac6d969240bbd"}