{"configurationSha256":"d648ac40a33aafc351490d5b006270eeb74993ad976aa3b79155dd3fda36f665","datasetId":"fleetpy-manhattan-zenodo-15187906-v1","eligibleRecordCount":2757,"eventOrderingId":"ridebound-event-order-v1","excludedRecordCount":22217,"exclusionLogSha256":"6815d2c0f0e1ed4512f945482d3a6c98e34cd37c05617c6c4f3de04703f6e7bf","inputRecordCount":24974,"normalizerId":"fleetpy-manhattan-normalizer","normalizerSourceSha256":"34517a832014c78a572282e01795fc243896db088249fd6dade70beed2aa4d90","normalizerVersion":"1.0.0","reportId":"report-f9e61df138051b64025dbda9","roundingRuleId":"ties-to-even-v1","scenarioContentSha256":"a22b3ecfe08b576e578043340ebd5275ebd51bc94d1f146af8c8a1ceb16e96bd","scenarioHash":"f9e61df138051b64025dbda97ad0a2ab326da724c98ce759d46050f712ce275f","schemaVersion":"1.0.1","selectedRecordCount":108,"selectionFrameSha256":"210ea134b1f19c0565fe33cd14aef121f78896a27f9b0d30c332238f74bbe378","selectionRuleId":"greedy-induced-coverage-node-pool-hmac-row-v1","sourceArtifactSha256":"d9e86f33645e5eec287d387f8d63ad41ddf41d4ef648138b65d636482e2c599e","sourceMemberInventorySha256":"f9b28bb17850881e2e1a0784d7ff0aa1885b7175ab9be8db5e8ac6d969240bbd"}