{"configurationSha256":"d46e3848b47681e3bba58879a88637e5a185ffe33cff6fc1151bd7b0c30d6981","datasetId":"fleetpy-manhattan-zenodo-15187906-v1","eligibleRecordCount":2726,"eventOrderingId":"ridebound-event-order-v1","excludedRecordCount":15792,"exclusionLogSha256":"20b749f877a82038e81a740537a4d537f2ff14ba0bb6cf405802c98c18e6cd26","inputRecordCount":18518,"normalizerId":"fleetpy-manhattan-normalizer","normalizerSourceSha256":"34517a832014c78a572282e01795fc243896db088249fd6dade70beed2aa4d90","normalizerVersion":"1.0.0","reportId":"report-9e16c78d4d1ade1af6e52ea2","roundingRuleId":"ties-to-even-v1","scenarioContentSha256":"2fa7852512b06b7c2d4f234a7e6e245c7adbc6be765dc5d083b45b9365313923","scenarioHash":"9e16c78d4d1ade1af6e52ea2daedfd7ec8469b10b6a41c306de16d1a24e59e2d","schemaVersion":"1.0.1","selectedRecordCount":128,"selectionFrameSha256":"ff9447202df7d4ae9c62e235090fc91a3b26da4feb1b78155e6821390f9859ec","selectionRuleId":"greedy-induced-coverage-node-pool-hmac-row-v1","sourceArtifactSha256":"d9e86f33645e5eec287d387f8d63ad41ddf41d4ef648138b65d636482e2c599e","sourceMemberInventorySha256":"f9b28bb17850881e2e1a0784d7ff0aa1885b7175ab9be8db5e8ac6d969240bbd"}