{"configurationSha256":"1c713bcb99b5a3cdac4c9a68e596f64967c8cbd07d8056877d9dd1e71ee91204","datasetId":"fleetpy-manhattan-zenodo-15187906-v1","eligibleRecordCount":2844,"eventOrderingId":"ridebound-event-order-v1","excludedRecordCount":22130,"exclusionLogSha256":"ec6b6f7f22ececb5cb8c755da361701ca8daa99b0c579d7ae5768ae89e19b51f","inputRecordCount":24974,"normalizerId":"fleetpy-manhattan-normalizer","normalizerSourceSha256":"34517a832014c78a572282e01795fc243896db088249fd6dade70beed2aa4d90","normalizerVersion":"1.0.0","reportId":"report-594e0e67230da4776d457894","roundingRuleId":"ties-to-even-v1","scenarioContentSha256":"ce4cc69cc3f6464999b5ab538a3e79cf7ef8029da62b60e2b1525a111ced3699","scenarioHash":"594e0e67230da4776d457894257b9c3fc4f9ed0a09819ca9f85724dd63ae9231","schemaVersion":"1.0.1","selectedRecordCount":128,"selectionFrameSha256":"d68435651cc811d6eb04f7c1d63f3a8e5cf85da1cecb886910416ad67c2ab9c1","selectionRuleId":"greedy-induced-coverage-node-pool-hmac-row-v1","sourceArtifactSha256":"d9e86f33645e5eec287d387f8d63ad41ddf41d4ef648138b65d636482e2c599e","sourceMemberInventorySha256":"f9b28bb17850881e2e1a0784d7ff0aa1885b7175ab9be8db5e8ac6d969240bbd"}