{"configurationSha256":"a2d8996ccbe73189bcaeff8ece4347b0b8d80eeb8713b90956861a22724f645c","datasetId":"fleetpy-manhattan-zenodo-15187906-v1","eligibleRecordCount":2457,"eventOrderingId":"ridebound-event-order-v1","excludedRecordCount":22067,"exclusionLogSha256":"9b6f0b1464a8dfe42982e100d18ab14d3f6aaf22f6d15d65c5b858654cb4a63e","inputRecordCount":24524,"normalizerId":"fleetpy-manhattan-normalizer","normalizerSourceSha256":"34517a832014c78a572282e01795fc243896db088249fd6dade70beed2aa4d90","normalizerVersion":"1.0.0","reportId":"report-3b7d99725a2a1933c39f6bb1","roundingRuleId":"ties-to-even-v1","scenarioContentSha256":"610121e417b643ee5f7ea46f637ee19281d0aabf7bd978eb3864aeb2cbde64a5","scenarioHash":"3b7d99725a2a1933c39f6bb142e6241ee7d0cfa1c41c89d2eb210c13d0c54b9f","schemaVersion":"1.0.1","selectedRecordCount":108,"selectionFrameSha256":"c379304b3ee71bf7889016c34e332322c3b00b8c4ebc8cf269cba8cbd316a11c","selectionRuleId":"greedy-induced-coverage-node-pool-hmac-row-v1","sourceArtifactSha256":"d9e86f33645e5eec287d387f8d63ad41ddf41d4ef648138b65d636482e2c599e","sourceMemberInventorySha256":"f9b28bb17850881e2e1a0784d7ff0aa1885b7175ab9be8db5e8ac6d969240bbd"}