{"configurationSha256":"e35de94bca87bc91a1287e34e703b2f993f26953b3093a8a576443f9f566f379","datasetId":"fleetpy-manhattan-zenodo-15187906-v1","eligibleRecordCount":24076,"eventOrderingId":"ridebound-event-order-v1","excludedRecordCount":0,"exclusionLogSha256":"4f53cda18c2baa0c0354bb5f9a3ecbe5ed12ab4d8e11ba873c2f11161202b945","inputRecordCount":24076,"normalizerId":"fleetpy-manhattan-normalizer","normalizerSourceSha256":"34517a832014c78a572282e01795fc243896db088249fd6dade70beed2aa4d90","normalizerVersion":"1.0.0","reportId":"report-8158f031a98cb1c314d6880b","roundingRuleId":"ties-to-even-v1","scenarioContentSha256":"a03af8a7e5ff471818281c7905f59a56dd7e82b1da8933213c499f4d31d33637","scenarioHash":"8158f031a98cb1c314d6880bb97312fc0e96a07717de7ee9be26b4283c1cebfa","schemaVersion":"1.0.1","selectedRecordCount":128,"selectionFrameSha256":"87ad90327300e169cffa6e1a5eacc8e33674c5a7d66d7b63f8afc1f806f7ecea","selectionRuleId":"greedy-induced-coverage-node-pool-hmac-row-v1","sourceArtifactSha256":"d9e86f33645e5eec287d387f8d63ad41ddf41d4ef648138b65d636482e2c599e","sourceMemberInventorySha256":"f9b28bb17850881e2e1a0784d7ff0aa1885b7175ab9be8db5e8ac6d969240bbd"}