{"configurationSha256":"d9884789b7332f8b20386d2ab64b965221d567884b69e70163ed94ec8f589cac","datasetId":"fleetpy-manhattan-zenodo-15187906-v1","eligibleRecordCount":1596,"eventOrderingId":"ridebound-event-order-v1","excludedRecordCount":24163,"exclusionLogSha256":"82f63958ca22780eca10bb242de24a3373b8e8d6966c2100a7441af6c1e0f50a","inputRecordCount":25759,"normalizerId":"fleetpy-manhattan-normalizer","normalizerSourceSha256":"34517a832014c78a572282e01795fc243896db088249fd6dade70beed2aa4d90","normalizerVersion":"1.0.0","reportId":"report-048cdd6a10128ccfc0df7a8d","roundingRuleId":"ties-to-even-v1","scenarioContentSha256":"061e317f113dc84a80e01fe92325132b5edfaebe20303522297e1f1b2612d491","scenarioHash":"048cdd6a10128ccfc0df7a8d86b338083e8997b446ae24443458dc2c544bc2bc","schemaVersion":"1.0.1","selectedRecordCount":108,"selectionFrameSha256":"be36ffa85c440657a2e1e6922f1c2c020bdee0915168f15e9dd4b5fec5488911","selectionRuleId":"greedy-induced-coverage-node-pool-hmac-row-v1","sourceArtifactSha256":"d9e86f33645e5eec287d387f8d63ad41ddf41d4ef648138b65d636482e2c599e","sourceMemberInventorySha256":"f9b28bb17850881e2e1a0784d7ff0aa1885b7175ab9be8db5e8ac6d969240bbd"}