{"configurationSha256":"0c401fa2baf8fb047a7d4ccabb2148a4f21be6ef85aed5c3acfe0f9c60698067","datasetId":"fleetpy-manhattan-zenodo-15187906-v1","eligibleRecordCount":2640,"eventOrderingId":"ridebound-event-order-v1","excludedRecordCount":21436,"exclusionLogSha256":"801ce16044076bbcd61b787e77ac085a4cf1ef65c113f4c784b03822915020a9","inputRecordCount":24076,"normalizerId":"fleetpy-manhattan-normalizer","normalizerSourceSha256":"34517a832014c78a572282e01795fc243896db088249fd6dade70beed2aa4d90","normalizerVersion":"1.0.0","reportId":"report-8050c70af3e8cd8bbf82fe2c","roundingRuleId":"ties-to-even-v1","scenarioContentSha256":"557dbc4c208fa7d858d10971362574864f5415913df49681f260e12cccb5a3a4","scenarioHash":"8050c70af3e8cd8bbf82fe2ca86c267ab1aa6cb18b34491cc62c86b316a42ea1","schemaVersion":"1.0.1","selectedRecordCount":108,"selectionFrameSha256":"47945b0a135abd8356edd5b112ca8c575d0c9b97090b545cb85578169dd2d76b","selectionRuleId":"greedy-induced-coverage-node-pool-hmac-row-v1","sourceArtifactSha256":"d9e86f33645e5eec287d387f8d63ad41ddf41d4ef648138b65d636482e2c599e","sourceMemberInventorySha256":"f9b28bb17850881e2e1a0784d7ff0aa1885b7175ab9be8db5e8ac6d969240bbd"}