{"configurationSha256":"7acdae3bc70f0f01f2fd43a4557b1c7c05d7670cb2c4ead59212c9ab30a5023c","datasetId":"fleetpy-manhattan-zenodo-15187906-v1","eligibleRecordCount":2676,"eventOrderingId":"ridebound-event-order-v1","excludedRecordCount":15842,"exclusionLogSha256":"4cbad5a329b2ba1e51e462b34bef13b4fbbf465ab065f91ad75dec8c8e3f8b0c","inputRecordCount":18518,"normalizerId":"fleetpy-manhattan-normalizer","normalizerSourceSha256":"34517a832014c78a572282e01795fc243896db088249fd6dade70beed2aa4d90","normalizerVersion":"1.0.0","reportId":"report-61067ee924bfa5fcb24535a5","roundingRuleId":"ties-to-even-v1","scenarioContentSha256":"37f0315b3177e2acf95ca53abd9e53dc7f3f32db47f18137374e6a235d12dc58","scenarioHash":"61067ee924bfa5fcb24535a5bebc7fa6197176a7ea5eb9b0f85bd5671d4d8e94","schemaVersion":"1.0.1","selectedRecordCount":108,"selectionFrameSha256":"833e6e0645f9795eece91bd73949817b39946ec3b24c676200653e17c72830e5","selectionRuleId":"greedy-induced-coverage-node-pool-hmac-row-v1","sourceArtifactSha256":"d9e86f33645e5eec287d387f8d63ad41ddf41d4ef648138b65d636482e2c599e","sourceMemberInventorySha256":"f9b28bb17850881e2e1a0784d7ff0aa1885b7175ab9be8db5e8ac6d969240bbd"}